{
  "audit_id": "aud-d4e5f6a7b8c9",
  "created_at": "2026-03-28T09:15:00Z",
  "event_type": "skill_merged",
  "skill_id": "web-scraper.skill",
  "subject_id": "skl-a1b2c3d4e5f6",
  "actor": "claude-opus-4-6",
  "details": {
    "action": "MERGE",
    "lesson": "Prefer page.evaluate() over page.$() for complex DOM traversals in shadow DOMs",
    "confidence": 0.85,
    "reasoning": "New lesson about shadow DOM handling is compatible with and extends existing skill 'Handle dynamic content loading'. Added as new bullet point.",
    "previous_version": "0.2.0",
    "new_version": "0.2.1",
    "experience_id": "exp-f1e2d3c4b5a6",
    "snapshot_id": "snap-e5f6a7b8c9d0"
  },
  "evidence_refs": [
    "experience/exp-f1e2d3c4b5a6.json",
    "snapshots/snap-e5f6a7b8c9d0.json"
  ]
}
